{
  "schema": "promptbranch.orchestration.evidence",
  "schema_version": "1.0",
  "stage": "foundation",
  "checks": [
    {
      "name": "schemas_present",
      "status": "passed",
      "summary": "Context, decision, and evidence schemas exist."
    },
    {
      "name": "model_execution_blocked_by_contract",
      "status": "passed",
      "summary": "All planning examples declare model_may_execute=false."
    }
  ],
  "decision": "foundation_surfaces_present",
  "created_at": "2026-05-25T00:00:00Z",
  "producer": "promptbranch_orchestration_fixture"
}
